<?xml version="1.0" encoding="UTF-8"?>
<xs:schema xmlns:xs="http://www.w3.org/2001/XMLSchema" elementFormDefault="qualified">

   
    <xs:element name="portfolio">
        <xs:complexType>
            <xs:sequence>
                <xs:element name="personal" type="personalType"/>
                <xs:element name="about" type="aboutType"/>
                <xs:element name="education" type="educationType"/>
                <xs:element name="skills" type="skillsType"/>
                <xs:element name="hobbies" type="hobbiesType"/>
                <xs:element name="contact" type="contactType"/>
            </xs:sequence>
        </xs:complexType>
    </xs:element>

  
    <xs:complexType name="personalType">
        <xs:sequence>
            <xs:element name="name" type="xs:string"/>
            <xs:element name="firstname" type="xs:string"/>
            <xs:element name="lastname" type="xs:string"/>
            <xs:element name="title" type="xs:string"/>
            <xs:element name="description" type="xs:string"/>
        </xs:sequence>
    </xs:complexType>

 
    <xs:complexType name="aboutType">
        <xs:sequence>
            <xs:element name="text" type="xs:string"/>
            <xs:element name="image" type="xs:string"/>
        </xs:sequence>
    </xs:complexType>

   
    <xs:complexType name="educationType">
        <xs:sequence>
            <xs:element name="item" maxOccurs="unbounded">
                <xs:complexType>
                    <xs:sequence>
                        <xs:element name="date" type="xs:string"/>
                        <xs:element name="degree" type="xs:string"/>
                        <xs:element name="institution" type="xs:string"/>
                        <xs:element name="description" type="xs:string"/>
                    </xs:sequence>
                </xs:complexType>
            </xs:element>
        </xs:sequence>
    </xs:complexType>

  
    <xs:complexType name="skillsType">
        <xs:sequence>
            <xs:element name="category" maxOccurs="unbounded">
                <xs:complexType>
                    <xs:sequence>
                        <xs:element name="name" type="xs:string"/>
                        <xs:element name="items">
                            <xs:complexType>
                                <xs:sequence>
                                    <xs:element name="item" type="xs:string" maxOccurs="unbounded"/>
                                </xs:sequence>
                            </xs:complexType>
                        </xs:element>
                    </xs:sequence>
                </xs:complexType>
            </xs:element>
        </xs:sequence>
    </xs:complexType>


    <xs:complexType name="hobbiesType">
        <xs:sequence>
            <xs:element name="hobby" maxOccurs="unbounded">
                <xs:complexType>
                    <xs:sequence>
                        <xs:element name="icon" type="xs:string"/>
                        <xs:element name="name" type="xs:string"/>
                        <xs:element name="description" type="xs:string"/>
                    </xs:sequence>
                </xs:complexType>
            </xs:element>
        </xs:sequence>
    </xs:complexType>

 
    <xs:complexType name="contactType">
        <xs:sequence>
            <xs:element name="intro" type="xs:string"/>
            <xs:element name="items">
                <xs:complexType>
                    <xs:sequence>
                        <xs:element name="item" maxOccurs="unbounded">
                            <xs:complexType>
                                <xs:simpleContent>
                                    <xs:extension base="xs:string">
                                        <xs:attribute name="type" use="required">
                                            <xs:simpleType>
                                                <xs:restriction base="xs:string">
                                                    <xs:enumeration value="Location"/>
                                                    <xs:enumeration value="Email"/>
                                                    <xs:enumeration value="Phone"/>
                                                    <xs:enumeration value="Github"/>
                                                    <xs:enumeration value="Facebook"/>
                                                    <xs:enumeration value="Instagram"/>
                                                </xs:restriction>
                                            </xs:simpleType>
                                        </xs:attribute>
                                    </xs:extension>
                                </xs:simpleContent>
                            </xs:complexType>
                        </xs:element>
                    </xs:sequence>
                </xs:complexType>
            </xs:element>
        </xs:sequence>
    </xs:complexType>
</xs:schema>